id,name,category_id,description,website_url,pricing,pricing_url,pros,cons,best_for,rating,rating_count,tutorial_url,status,created_at,updated_at
0e688e8a-ce5c-4214-a09a-e2cb62484661,Videotok,ab556a13-0a09-4cb2-8c0b-98197d48ac5b,"Offers a user-friendly interface with AI avatars, auto-zooms, transitions, and sound effects for high-quality faceless video ads.",https://videotok.com,Starts ~$25/mo,,"[""Dynamic Camera Movement (Auto-Zoom)"",""AI Avatars & Sound Effects"",""Minimal Technical Skill Needed"",""Quick Ad Creation""]",,"Quick Video Ads, Simple Explainer Videos, and Low-Skill Production.",4.50,0,,active,2025-11-25 11:01:43.442345+00,2025-11-25 11:01:43.442345+00
107440ed-2577-48c1-85ae-22270390b070,CAMB.AI,ab556a13-0a09-4cb2-8c0b-98197d48ac5b,"A specialized platform known for AI Dubbing and Localization, translating content into 140+ languages while preserving the original voice's tone.",https://www.camb.ai,High-Tier/Enterprise Pricing,,"[""True Multilingual Dubbing"",""MARS/BOLI Voice Models"",""Preserves Tone & Background Noise"",""AI Smart Cutting""]",,"YouTube Multi-Language Audio Tracks, Global Content Scalers.",4.70,0,,active,2025-11-25 08:56:09.508192+00,2025-11-25 08:56:09.508192+00
118b8f76-3b67-444b-871e-da0e8eb03373,Descript,ab556a13-0a09-4cb2-8c0b-98197d48ac5b,"Text-based video/audio editing, Studio Sound AI noise removal, and Overdub voice cloning.",https://descript.com,Creator: $12/mo | Pro: $24/mo,,"[""Edit video like text"",""Excellent Studio Sound AI"",""Screen recording included""]","[""Cloud-based can be slow"",""Render times vary""]",YouTube (Tutorials & Software Reviews),4.75,450,,active,2025-11-24 16:02:03.917266+00,2025-11-24 16:02:03.917266+00
3221f65e-c382-4b28-a1b2-cedad8888002,Kapwing,ab556a13-0a09-4cb2-8c0b-98197d48ac5b,"An online, collaborative suite with AI features like automatic subtitles, background removal, and instant resizing for cross-posting.",https://www.kapwing.com,Starts ~$16/mo (Free tier available),,"[""AI Smart Cut (Silence Removal)"",""Browser-Based & Collaborative"",""Instant Cross-Posting Resizing"",""Automatic Subtitles""]",,"Social Media Repurposing, Collaborative Projects, and quick browser editing.",4.50,0,,active,2025-11-25 08:56:09.508192+00,2025-11-25 08:56:09.508192+00
41ccae63-b798-4dfa-821a-4bbe61376d2b,ShortsNinja,ab556a13-0a09-4cb2-8c0b-98197d48ac5b,"Automates faceless video creation with AI-generated voiceovers and visuals, utilizing top AI models for high-quality shorts.",https://shortsninja.io,Starts ~$39/mo,,"[""Unified AI Stack (Top Models)"",""5-Minute Production Workflow"",""Automated Visuals and Voiceovers"",""Monetization Focus""]",,"High-Volume Shorts Production, Monetizing YouTube Shorts.",4.70,0,,active,2025-11-25 11:01:43.442345+00,2025-11-25 11:01:43.442345+00
43168377-90df-446b-83b0-8d9d910fd149,Canva AI,ab556a13-0a09-4cb2-8c0b-98197d48ac5b,"Simplifies faceless video creation with AI-powered design tools, auto-resizing, and background removal, focusing on visual asset creation.",https://www.canva.com/ai,Free / Pro starts ~$15/mo,,"[""Auto-Resizing & Templates"",""Background Removal"",""Visual Asset Creation"",""Collaborative Design Space""]",,"Visual Asset Creation, Thumbnail Design, Brand Consistency, and Repurposing.",4.60,0,,active,2025-11-25 11:01:43.442345+00,2025-11-25 11:01:43.442345+00
483eae85-65e6-4b9e-9bcc-22cbd1a17868,ElevenLabs,e63bb221-0741-4fd2-a62d-3d4841d4b240,"Industry-leading AI voice generator with realistic speech synthesis, custom voice cloning, and multilingual support.",https://elevenlabs.io,Creator: $11/mo | Pro: $99/mo,,"[""Unmatched realism"",""Emotional range control"",""Multilingual support""]","[""Higher cost than competitors"",""Generous free tier makes paid hard for some""]","YouTube (Long-Form, Authority Narration)",4.90,500,,active,2025-11-24 16:02:03.917266+00,2025-11-24 16:02:03.917266+00
4db7905c-a4ca-458f-9c31-5db4108b864c,Fliki,b428793c-bc3b-4d8b-98ca-7a338df4439f,"Text-to-video with AI voiceovers, large stock media library, and integrated subtitle generation.",https://fliki.ai,$28-88/month,,"[""Intuitive workflow"",""All-in-one platform"",""Strong subtitle generation""]","[""Less voice realism than ElevenLabs"",""Stock media limitations""]","YouTube (Educational Content, Short explainers)",4.50,0,,active,2025-11-24 17:05:18.89047+00,2025-11-24 17:05:18.89047+00
5311d774-4a59-4452-ad13-136b40e5df8b,Crreo AI,ab556a13-0a09-4cb2-8c0b-98197d48ac5b,A free AI video generator alternative that allows creation of up to 15-minute faceless videos with 100% AI content.,https://crreo.ai,Free / Pro starts ~$9/mo,,"[""Generous Free Tier (15-min Videos)"",""100% AI Content Creation"",""Budget-Friendly Scaling"",""No Watermark on Free Videos""]",,"Budget-Friendly Scaling, Content Testing, and Zero-Cost Channels.",4.40,0,,active,2025-11-25 11:01:43.442345+00,2025-11-25 11:01:43.442345+00
5913bd31-d79b-4e59-bf43-2b861711bee1,Pika 2.2,ab556a13-0a09-4cb2-8c0b-98197d48ac5b,"Focuses on quick, automated video content generation with unique creative manipulation tools for stylized effects.",https://pika.art,Free / Pro starts ~$8/mo,,"[""Pikaffects Feature (Creative Manipulation)"",""Quick, Automated Video Generation"",""Integrates AI Voiceovers""]",,"Quick, Stylized Creative Effects, Tutorials, News, or Presentations.",4.80,0,,active,2025-11-25 11:11:18.737849+00,2025-11-25 11:11:18.737849+00
629d7039-f81b-43b2-bea6-b550b8e417a5,Nova Reel,ab556a13-0a09-4cb2-8c0b-98197d48ac5b,AI video generation platform specialized in engaging social video content with customizable avatars and backgrounds.,https://novareel.ai,Starts ~$19/mo,,"[""Social Trend Awareness"",""Customizable Avatars and Backgrounds"",""Specialized for Social Video Content""]",,"Engaging Social Video Content, Connecting with Social Creative Trends.",4.40,0,,active,2025-11-25 11:11:18.737849+00,2025-11-25 11:11:18.737849+00
6dc18e18-7df8-4292-a936-bbbcf443e818,Hunyuan Video by Tencent,ab556a13-0a09-4cb2-8c0b-98197d48ac5b,"Open-source model producing high-quality, text-relevant videos with smooth natural motion, supporting text-to-video and image-to-video.",https://tencent.com/hunyuan-video,Free (Open Source),,"[""Superior Motion Quality & Smoothness"",""Open Source (for Developers)"",""High-Quality Text-Relevant Videos""]",,"Advanced Faceless Storytelling, Open Source Development, Superior Motion Quality.",4.70,0,,active,2025-11-25 11:11:18.737849+00,2025-11-25 11:11:18.737849+00
6e85a55f-9cb9-405f-b635-c6614ee97c77,CopyCopter.ai,ab556a13-0a09-4cb2-8c0b-98197d48ac5b,AI-driven script writing combined with video generation tools. Optimizes content for engagement and reach on YouTube.,https://copycopter.ai,Starts ~$35/mo,,"[""One-Click Script & Visual Sync"",""AI-Driven Script Writing"",""Optimizes Content for Engagement"",""High-Quality Voiceovers""]",,"Niche YouTube Content Generation, Tutorials, Reviews, and Storytelling.",4.60,0,,active,2025-11-25 11:11:18.737849+00,2025-11-25 11:11:18.737849+00
745896e9-5de0-47cb-9724-d117d66c68c2,Google Cloud Text-to-Speech,3e2ddc9d-9d4f-49f5-95bd-171ae6133ea7,"Utilizes Google's deep learning models (Wavenet & Neural2) for natural speech quality, particularly for informational delivery.",https://cloud.google.com/text-to-speech,Pay-as-you-go (Character based),,"[""Industry-Leading Wavenet Technology"",""Massive Language Support (50+)"",""Precise SSML control""]",,"Developers, high-volume transactional content, apps.",4.80,0,,active,2025-11-25 08:00:41.050703+00,2025-11-25 08:00:41.050703+00
7671827f-55e6-4496-852f-d4ab9a73c74d,Runway Gen-2 / Runway ML,ab556a13-0a09-4cb2-8c0b-98197d48ac5b,"The industry leader for generating realistic, high-fidelity footage for documentaries and visual effects using text-to-video and image-to-video.",https://runwayml.com,Starts ~$15/mo (Generous Free Trial),,"[""Multi-Motion Brush / Advanced Controls"",""Text-to-Video, Image-to-Video"",""High-Fidelity Cinematic Videos""]",,"Cinematic Visual Storytelling, Professional High-Fidelity Faceless Content.",4.90,0,,active,2025-11-25 11:11:18.737849+00,2025-11-25 11:11:18.737849+00
84c93e85-0cc5-4bef-a82d-867544f9df40,BigMotion AI,ab556a13-0a09-4cb2-8c0b-98197d48ac5b,"Dedicated faceless AI video generator that automates visuals, captions, voiceovers, and music, simplifying production for passive income.",https://bigmotion.ai,Starts ~$49/mo,,"[""Multi-Platform Auto-Publishing"",""Dedicated Faceless Video Generator"",""Automates Visuals, Captions, Voiceovers""]",,"Passive Income Automation, Fully Automated Faceless Channels, Quick Content Creation.",4.50,0,,active,2025-11-25 11:11:18.737849+00,2025-11-25 11:11:18.737849+00
896469a8-0b4f-44a3-8b01-e3f6a618c753,zeroface.ai,ab556a13-0a09-4cb2-8c0b-98197d48ac5b,A tool designed specifically for creating faceless short-form content by focusing on viral scripting and theme options for multi-platform publishing.,https://zeroface.ai,Starts ~$14/mo,,"[""Formulaic Scripting"",""Faceless Shorts Templates"",""Viral Script Psychology"",""Automatic Multi-Platform Publishing""]",,"TikTok, YouTube Shorts, and creators focused strictly on high-volume shorts.",4.30,0,,active,2025-11-25 08:56:09.508192+00,2025-11-25 08:56:09.508192+00
8db7c1a0-2fa2-4ad5-8aae-9d6b38a8cdc0,InVideo AI,b428793c-bc3b-4d8b-98ca-7a338df4439f,"Prompt-to-video generation; input a topic and get a full script, visuals, and voiceover instantly.",https://invideo.io,$20-48/month,,"[""Extremely fast generation"",""Good for testing trends"",""Large template library""]","[""Output needs fine-tuning"",""Less control over final visuals""]","TikTok, YouTube Shorts (Rapid Prototyping)",4.40,0,,active,2025-11-24 17:05:18.89047+00,2025-11-24 17:05:18.89047+00
9d9a30bc-911e-4a55-870f-ec8672d9b256,Camtasia,ab556a13-0a09-4cb2-8c0b-98197d48ac5b,"A powerful screen recording and editing suite specializing in clean, professional software demos and tutorials.",https://www.techsmith.com/camtasia.html,Starts ~$180 (Perpetual license),,"[""Cursor Smoothing/Highlighting"",""Rev Guided Workflow (Layouts)"",""Animated Text Overlays"",""AI Script Writing (via Audiate)""]",,"Software Tutorials, Udemy Courses, and Educational Content.",4.70,0,,active,2025-11-25 08:56:09.508192+00,2025-11-25 08:56:09.508192+00
9e4aa1a7-1985-4532-a102-4bbe7af643cc,Kling AI,ab556a13-0a09-4cb2-8c0b-98197d48ac5b,Affordable AI video generation with high-quality output. Excels at maintaining character and object consistency across different shots.,https://kling.ai,Affordable (Est. ~$12/mo),,"[""Character Consistency & Lip-Sync"",""High-Quality Output Rivaling Runway"",""Control over Video Elements""]",,"High Consistency, Mixed-Media Faceless Videos, Content Replacement Scenarios.",4.80,0,,active,2025-11-25 11:11:18.737849+00,2025-11-25 11:11:18.737849+00
a2c91974-a707-481c-aced-d5454cd3fd99,AutoFeed,ab556a13-0a09-4cb2-8c0b-98197d48ac5b,"AI video generator optimized for viral trends, creating professional faceless videos quickly (under 30 seconds).",https://autofeed.ai,Starts ~$29/mo,,"[""Ultra-Fast 30s Generation"",""Optimized for Viral Trends"",""Automatic Visual Scene Matching"",""AI Voiceover Integration""]",,"TikTok, YouTube Shorts, and hyper-fast content production.",4.60,0,,active,2025-11-25 11:01:43.442345+00,2025-11-25 11:01:43.442345+00
aca07ace-8865-44c1-a53b-2c2ad5bfda31,Pictory,b428793c-bc3b-4d8b-98ca-7a338df4439f,AI video creation from text and scripts. Specializes in blog-to-video conversion and creating automated video highlights.,https://pictory.ai,Standard: $19/mo | Premium: $39/mo,,"[""Fast blog-to-video conversion"",""Automated highlight reels"",""Bulk video creation""]","[""Stock video can be generic"",""Editing interface is simple""]","YouTube (Repurposing Blog Content, High Volume)",4.60,400,,active,2025-11-24 16:02:03.917266+00,2025-11-24 16:02:03.917266+00
ae5dd0d7-60ad-4899-be76-0141392ecd43,DaVinci Resolve,ab556a13-0a09-4cb2-8c0b-98197d48ac5b,"A professional-grade editor with industry-leading color grading and high-end visual effects, making it ideal for cinematic faceless content.",https://www.blackmagicdesign.com/products/davinciresolve,Free / Studio $295 (One-time purchase),,"[""Magic Mask (Object Isolation)"",""IntelliScript Timeline"",""World-Class Color Grading"",""Powerful and free core version""]",,High-Quality YouTube Documentaries and Cinematic Video.,4.80,0,,active,2025-11-25 08:56:09.508192+00,2025-11-25 08:56:09.508192+00
b42ca11c-ff7c-4e8a-bd03-8e49ec72306e,Filmora,ab556a13-0a09-4cb2-8c0b-98197d48ac5b,"User-friendly editor with a traditional timeline, known for its massive library of customizable templates and stock footage assets.",https://filmora.wondershare.com,Perpetual license / Subscription ~$49/yr,,"[""AI Smart Short Clips"",""AI Image/Audio to Video"",""Massive Built-in Asset Library"",""Voiceover Recording""]",,"YouTube (Mid-Tier), Facebook Video, and beginners needing high-quality assets.",4.60,0,,active,2025-11-25 08:56:09.508192+00,2025-11-25 08:56:09.508192+00
bf2dc333-fedf-4321-b955-ab59dc3a7f7e,CapCut,e182947c-e133-4f1d-b97f-b8e77d2857ef,"Free advanced mobile/desktop video editing with trending effects, auto-captioning, and text-to-image AI tools.",https://www.capcut.com,Mostly Free | Pro: $8/mo,,"[""Free and powerful"",""Integrated trending effects"",""Excellent mobile app""]","[""Pro features limited"",""Export watermark on free tier""]","TikTok, Instagram Reels (Vertical Video)",4.55,0,,active,2025-11-24 17:05:18.89047+00,2025-11-24 17:05:18.89047+00
c1998d49-00dc-45b4-a1f5-4f602720bf10,Synthesia,ab3f90ef-3f3f-428d-b9b8-b4d601bc79eb,"Customizable AI avatars with text-to-speech and perfect lip-sync, ideal for e-learning and explainers.",https://synthesia.io,$300+/month (Enterprise),,"[""Consistent digital presenter"",""Massive language support"",""Professional quality""]","[""Very high cost"",""Less suitable for casual content""]","E-learning, Corporate Explainers (High-Budget)",4.20,0,,active,2025-11-24 17:05:18.89047+00,2025-11-24 17:05:18.89047+00
c1cc92e0-58b6-424e-a3ba-80101756488d,Murf.ai,3e2ddc9d-9d4f-49f5-95bd-171ae6133ea7,An integrated studio environment that allows users to sync the voiceover to video/presentation timing directly within the platform.,https://murf.ai,Mid-to-high (Starts ~$19/mo),,"[""120+ realistic voices"",""Integrated Studio Environment"",""Grammar Assistant""]",,"Corporate videos, eLearning, audiobooks, and software training.",4.70,0,,active,2025-11-25 08:00:41.050703+00,2025-11-25 08:00:41.050703+00
e9073a1f-0b60-4a24-bd9e-d4f3d1cbfca9,Crayo AI,ab556a13-0a09-4cb2-8c0b-98197d48ac5b,"Alternative to Runway AI with strong video clip creation tools, emphasizing editing features to fine-tune generated content.",https://crayo.ai,Starts ~$10/mo,,"[""Enhanced Clip Editing & Fine-Tuning"",""Strong Video Clip Creation Tools"",""Equipped with Editing Features""]",,"Creative Control Alternative, Fine-Tuning Generated Clips, Attention-Grabbing Content.",4.30,0,,active,2025-11-25 11:11:18.737849+00,2025-11-25 11:11:18.737849+00
e9a81cc4-c657-408d-9dff-062ee1d2f104,Resemble.ai,3e2ddc9d-9d4f-49f5-95bd-171ae6133ea7,"Known for high-fidelity voice cloning and real-time performance, suitable for interactive and dynamic personalized audio.",https://resemble.ai,Enterprise / Premium Pricing,,"[""High-Fidelity Voice Cloning"",""Resemble Fill (AI In-painting)"",""Low-latency API""]",,"Advertising, dynamic audio, game dev.",4.60,0,,active,2025-11-25 08:00:41.050703+00,2025-11-25 08:00:41.050703+00
ea338e58-0468-461b-9dec-e72bbc675f25,Lumen5,ab556a13-0a09-4cb2-8c0b-98197d48ac5b,"A platform that transforms text content (like blog posts) into engaging videos using AI, perfect for creating informational or marketing videos.",https://lumen5.com,Starts ~$19/mo (Limited Free tier),,"[""AI Scene Matching (Auto B-Roll)"",""Blog-to-Video Converter"",""Easy Platform Integration"",""Large Built-in Stock Library""]",,"LinkedIn, Facebook, Corporate Explainers, and Blog-to-Video workflows.",4.40,0,,active,2025-11-25 08:56:09.508192+00,2025-11-25 08:56:09.508192+00
f2e340c5-62b9-44d0-9446-d8f92dff1273,Adobe Premiere Pro,ab556a13-0a09-4cb2-8c0b-98197d48ac5b,"The industry standard, offering robust multi-camera editing, 3D titles, and seamless integration with the Adobe Creative Cloud ecosystem.",https://www.adobe.com/products/premiere.html,Starts ~$22/mo (CC Subscription),,"[""Generative Extend (AI Clips)"",""Text-Based Editing Integration"",""Adobe Ecosystem Sync"",""Powerful Multi-Camera Editing""]",,"Professional YouTube Channels, Commercials, and Advanced Motion Graphics.",4.80,0,,active,2025-11-25 08:56:09.508192+00,2025-11-25 08:56:09.508192+00
f56927b5-4b7e-40b0-a549-78bdb0efe684,Wondershare Filmora,e182947c-e133-4f1d-b97f-b8e77d2857ef,"Desktop editor with strong AI features like smart cutouts, motion tracking, and text-to-video tools.",https://filmora.wondershare.net,Perpetual License: $80-150,,"[""Strong blend of manual and AI control"",""Lifetime license option"",""Easy to learn""]","[""Not fully cloud-based"",""Interface can be cluttered""]",YouTube (Manual/Hybrid Editing),4.30,0,,active,2025-11-24 17:05:18.89047+00,2025-11-24 17:05:18.89047+00
fca53b10-968f-475c-bf4f-92616d41f268,Runway Gen-2,ab3f90ef-3f3f-428d-b9b8-b4d601bc79eb,"Cutting-edge Text-to-Video generation, image-to-video, and advanced motion brush controls for cinematic visuals.",https://runwayml.com,Standard: $15/mo | Pro: $35/mo,,"[""State-of-the-art visual quality"",""Complex camera movements"",""Intuitive UI""]","[""Expensive credit system"",""Short clip length limitations""]","TikTok, Instagram Reels, YouTube Shorts (Cinematic/Abstract)",4.80,0,,active,2025-11-24 17:05:18.89047+00,2025-11-24 17:05:18.89047+00